[
  {
    "id": "exp-finnegans-ai-developer",
    "role": "AI Developer",
    "company": "Finnegans",
    "companyUrl": "https://www.finnegans.com.ar",
    "location": "Argentina",
    "employmentType": "full-time",
    "workMode": "remote",
    "startDate": "2025-07",
    "endDate": null,
    "current": true,
    "summary": "Investigación y desarrollo de agentes de IA y bots para uso interno y productos.",
    "highlights": [
      "Investigación y desarrollo de agentes de IA y bots para procesos internos y productos para clientes.",
      "Implementación de mejoras internas, integraciones entre sistemas y funcionalidades basadas en IA (LLMs, RAG, agentes inteligentes).",
      "Trabajo con Angular, Python (FastAPI) y servicios en la nube (AWS), ampliando la visión hacia sistemas escalables orientados a datos.",
      "Ingeniería de prompts, tokenización, embeddings y protocolos de contexto de modelo (MCP) aplicados a agentes inteligentes.",
      "Tutor interno de Python e IA: tutorías personalizadas a desarrolladores de otros equipos y tutor en bootcamps de IA, agentes y arquitectura."
    ],
    "stack": [
      "skill-python",
      "skill-fastapi",
      "skill-angular",
      "skill-typescript",
      "skill-aws-lambda",
      "skill-aws-s3",
      "skill-dynamodb",
      "skill-amazon-bedrock",
      "skill-redis",
      "skill-strands",
      "skill-mcp",
      "skill-llms",
      "skill-rag",
      "skill-ai-agents",
      "skill-embeddings",
      "skill-tokenization",
      "skill-grafana",
      "skill-jenkins",
      "skill-sonarqube",
      "skill-websockets"
    ],
    "tags": ["ai", "full-time", "finnegans", "agents", "llm", "aws"],
    "featured": true,
    "order": 1,
    "visible": true
  },
  {
    "id": "exp-freelance-fullstack",
    "role": "Desarrollador Web Full-Stack",
    "company": "Freelance",
    "companyUrl": null,
    "location": "Concordia, Entre Ríos, Argentina",
    "employmentType": "freelance",
    "workMode": "remote",
    "startDate": "2025-01",
    "endDate": "2025-12",
    "current": false,
    "summary": "Desarrollo end-to-end de plataformas full-stack: UI/UX, frontend, backend y despliegue.",
    "highlights": [
      "Desarrollo end-to-end de plataformas full-stack para distintos clientes.",
      "Diseño UI/UX, frontend, backend, base de datos y despliegue en producción.",
      "Integración de APIs externas (aseguradoras, pasarelas de pago, correo) y herramientas de marketing digital."
    ],
    "stack": [
      "skill-nestjs",
      "skill-angular",
      "skill-react",
      "skill-typescript",
      "skill-postgresql",
      "skill-typeorm",
      "skill-figma",
      "skill-render",
      "skill-wordpress",
      "skill-woocommerce"
    ],
    "tags": ["freelance", "full-stack", "web", "clients"],
    "featured": true,
    "order": 2,
    "visible": true
  },
  {
    "id": "exp-cge-physics-teacher",
    "role": "Profesor de Física de Nivel Secundario",
    "company": "Consejo General de Educación",
    "companyUrl": null,
    "location": "Entre Ríos, Argentina",
    "employmentType": "full-time",
    "workMode": "onsite",
    "startDate": "2023-03",
    "endDate": "2025-12",
    "current": false,
    "summary": "Docencia de Física con foco en planificación, comunicación didáctica e investigación.",
    "highlights": [
      "Planificación estratégica: diseño de planes de estudio anuales.",
      "Comunicación y didáctica: desglose de temas abstractos y técnicos en explicaciones claras adaptadas a distintas audiencias.",
      "Investigación y síntesis: práctica constante en investigación de fuentes y análisis de información.",
      "Liderazgo y gestión de grupos: conducción y motivación de equipos en un ambiente colaborativo orientado a metas."
    ],
    "stack": [],
    "tags": ["teaching", "physics", "education", "leadership"],
    "featured": true,
    "order": 3,
    "visible": true
  }
]
